Companies,URL,Description,Industry,Country,Total Funding (M),All People,All Investors,Expert Collections,Market Reports,Company Status,Founded Year,Acquirer
Beth Israel Deaconess Medical Center,bidmc.org,"Beth Israel Deaconess Medical Center is an academic medical center. The centre's departments include a cancer center, pharmacy, radiology, surgery, radiation oncology, neurology, and dermatology. The company was founded in 1996 and is based in Boston, Massachusetts.",Medical Facilities & Services,United States,,"John Torous (Founder), Kris Laping (SVP), Joanne Pokaski (Senior Director)","Lahey Health Systems, DxQI Seed Grant Program",,,Alive / Active,1996,Lahey Health Systems
Pinellas Cancer Center,,"Pinellas Cancer Center provides medical cancer care services and is based in Florida. On March 8, 2021, Pinellas Cancer Center was acquired by The Oncology Institute of Hope and Innovation. The terms of the transaction were not disclosed.",Medical Facilities & Services,United States,,,The Oncology Institute of Hope and Innovation,,,Acquired,,The Oncology Institute of Hope and Innovation
MedSource,medsource.com,"MedSource is a full-service clinical research organization that focuses on complex study designs and diseases with a particular expertise in oncology and central nervous system disorders. On December 14, 2020, MedSource was acquired by Ergomed at a valuation between $16.2M and $25M.",Medical Facilities & Services,United States,9,"Paul Weitzel (CEO), John Hlywak (CFO)",Ergomed,,,Acquired,1997,Ergomed
AdvaGenix,advagenix.com,"AdvaGenix provides a bioinformatics platform to detect, annotate and classify genomic variants associated with multiple disorders, like oncology for patients with active cancers, hereditary cancer, cardiology, metabolism, pediatric disorders, and many others. It is based in Rockville, Maryland.",Medical Facilities & Services,United States,,Laura Kearns (COO),,,,Alive / Active,,
Avrok Biosciences,avrokbio.com,"Avrok Biosciences is a molecular laboratory primarily focused on cancer, infectious diseases, and autoimmune diseases. Its services include oncology, infectious diseases, surveillance, oral microbiome, research and development, and bioinformatics. It was founded in 2020 and is based in Azusa, California.",Medical Facilities & Services,United States,,,,,,Alive / Active,2020,
Veterinary Specialty Hospital of San Diego,vshsd.com,"Veterinary Specialty Hospital of San Diego (VSH) provides specialty veterinary care since 1990, fulfilling the need for specialty healthcare and emergency services for dogs and cats in San Diego County and Southern California. With hospitals conveniently located in Sorrento Valley and San Marcos, VSH provides exceptional patient care to all of San Diego County and beyond. 53 Doctors of Veterinary Medicine, including 28 board-certified specialists in the areas of surgery, internal medicine, medical oncology, radiation oncology, neurology/neurosurgery, ophthalmology, diagnostic imaging, emergency/critical care and dermatology serve the community.",Medical Facilities & Services,United States,,,Premier Veterinary Group,,,Merged,,Premier Veterinary Group
Trial Library,triallibrary.com,"Trial Library operates an oncology clinical trials company. It helps patients, providers, and pharmaceutical sponsors in clinical trials. The firm serves clients operating in the healthcare sector. The company was founded in 2022 and is based in San Francisco, California.",Medical Facilities & Services,United States,5,"Hala Borno (CEO), Stephen Buck (Chief Product Officer)","Lux Capital, NEXT VENTURES, Unseen Capital",,,Alive / Active,2022,
Central New York Research,cnyrc.org,Central New York Research exists to provide health care to veterans through access to medical research projects. Its research initiatives include: post-traumatic stress disorder; suicide prevention; substance abuse; oncology; gastrointestinal and infectious disease.,Medical Facilities & Services,United States,,,,,,Alive / Active,,
Bay Area Hospital,bayareahospital.org,"Bay Area Hospital offers a comprehensive range of diagnostic and therapeutic services. The hospital's inpatient and outpatient services include medical, surgical, pediatric, critical care, home health, outpatient and acute inpatient psychiatric, oncology, obstetrical, and other specialties.",Medical Facilities & Services,United States,,"Brian Moore (CEO), Samuel Patterson (CFO), Patrick Varga (CIO), Thomas Shine (Chief People Officer), Mike Murphy (Chief Medical Officer)",,,,Alive / Active,,
C.S. Mott Center for Human Growth and Development,mott.med.wayne.edu,"The C.S. Mott Center for Human Growth and Development is a research center. The center promotes research training relating to women's and children's health with focuses on reproductive biology, immunology, oncology, toxicology, and prenatal medicine. It is based in Detroit, Michigan.",Medical Facilities & Services,United States,,,,,,Alive / Active,,
Boca Biolistics,bocabio.com,"Boca Biolistics is a clinical research organization and biomaterials company focused on the procurement, storage, and sale of human biological samples. It specializes in infectious diseases and oncology for clinical trials and diagnostic development. The company was founded in 2005 and is based in Pompano Beach, Florida.",Medical Facilities & Services,United States,25.31,"Valentin Adia (Founder), Michael Morris (Founder)","Clairvest Group, U.S. Small Business Administration",,,Alive / Active,2005,
VHC Health,vhchealth.org,"VHC Health is a hospital. It provides medical services as its region's community health system. It provides stroke care, oncology, cancer care, emergency medicine, cardiovascular surgery, and other services. It was founded in 1944 and is based in Arlington, Virginia.",Medical Facilities & Services,United States,,,,,,Alive / Active,1944,
Riverside Community Hospital,riversidecommunityhospital.com,"Riverside Community Hospital is an acute care hospital. Its services include cardiac surgery (open heart), neuroscience or stroke, cardiology cath lab, neurosurgery, orthopedics, transplant, and general surgery or surgical oncology. It was founded in 1901 and is based in Riverside, California.",Medical Facilities & Services,United States,,,,,,Alive / Active,1901,
Memorial Hospital of Union County,memorialhosp.org,"Memorial Hospital of Union County provides medical and surgical hospital services. The hospital offers emergency care, cardiology, radiology, mental health, rehabilitation, neurology, surgery, gynecology, pediatrics, and oncology services. It was founded in 1952 and is based in Marysville, Ohio.",Medical Facilities & Services,United States,,,,,,Alive / Active,1952,
Eastern Idaho Regional Medical Center,eirmc.com,"Eastern Idaho Regional Medical Center (EIRMC) is an emergency care center that provides emergency care services, such as cardiovascular surgery, oncology, neurosurgery, intensive care, trauma, stroke, women's services, and inpatient rehab services. It is based in Idaho Falls, Idaho.",Medical Facilities & Services,United States,,"Jeff Sollis (CEO), Aaron Martin (CFO)",,,,Alive / Active,,
Radiology Specialists of Louisville,radiologylouisville.com,"Radiology Specialists of Louisville (RSL) is a radiology practice. The practice provides expert, sub-specialized care. The practice specializes in advanced CT and MRI diagnostic services, orthopedics and musculoskeletal imaging, women’s health, and cancer and oncology. It is based in Louisville, Kentucky.",Medical Facilities & Services,United States,,,,,,Alive / Active,,
Five Rivers Family Health Center,fiverivershealthcenters.org,"Five Rivers Family Health Center is a health care center with specialties in Family Medicine, Internal Medicine, Obstetrics/Gynecology, Pediatrics, Dental, Adult Transitional Sickle Cell, Infectious Diseases, General Surgery, Hand Surgery, Hematology/Oncology, Mental Health, Neurology, and Orthopedics.",Medical Facilities & Services,United States,1.1,"Gina McFarlane-El (CEO), Tara Brown (CFO), Diane Cummins (COO), Mamle Anim (Chief Medical Officer)",,,,Alive / Active,2011,
Kingman Regional Medical Center,azkrmc.com,"Kingman Regional Medical Center provides general medical and surgical hospital services Includes diabetes, diagnostic, emergency, hospice, oncology, pediatric, primary care, rehabilitation, and recovery, weight loss center, surgery, acute, cardiovascular, and respiratory services. It is based in Kingman, Arizona.",Medical Facilities & Services,United States,,"Tim Blanchard (CFO), Arek Shennar (CIO)",,,,Alive / Active,,
St. Elizabeth Physicians,stelizabethphysicians.com,"St. Elizabeth Physicians is a multi-specialty physician organization. The organization provides hospital and health care services, including addiction medicine, bariatric surgery, behavioral health, breast surgery, cardiology, dermatology, aesthetics, diagnostic services, electrophysiology, endocrinology, express care, family medicine, gastroenterology, general surgery, geriatrics, holistic health, infectious disease, internal medicine, nephrology, neuro-oncology, neurology, obstetrics, gynecology, occupational medicine, ophthalmology, orthopedics, pain management, spine, pediatrics, physiatry, podiatry, pulmonology, rheumatology, sleep medicine, surgical oncology, urgent care, urogynecology, urology, vascular surgery, and wound care. It is based in Erlanger, Kentucky.",Medical Facilities & Services,United States,,,,,,Alive / Active,,
Greenville Health System,ghs.org,"Greenville Health System (GHS)-a not-for-profit healthcare system in South Carolina-is committed to medical excellence through research, patient care and education. It's one of 100 systems nationwide to be designated an academic health system. The 1,358-bed system offers patients an innovative network of clinical integration, expertise and technologies through its six medical campuses, tertiary medical center, research and education facilities, community hospitals, physician practices and numerous specialty services throughout the Upstate. The GHS Cancer Institute is a regional leader in cancer care, offering National Cancer Institute-approved cancer treatment and prevention trials through the Community Clinical Oncology Program. GHS also offers Phase 1 clinical trials, genetic counseling, a blood and marrow transplant program and numerous patient-specific programs, including its Center for Integrative Oncology and Survivorship and the Institute for Translational Oncology Research, which works with more than 50 pharmaceutical and biotechnology partners to bring molecular diagnostics and new medication trials to the community setting.",Medical Facilities & Services,United States,1,,"Foundation Medicine, Prisma Health",,,Merged,1912,Prisma Health
QUE Oncology,queoncology.com,"QUE Oncology (QUE) was formed through a collaboration between Emory University, in Atlanta, Georgia, and The University of Queensland (UQ) research commercialization company, UniQuest, in Brisbane, Australia. The firm is developing novel therapies to address unmet medical needs in the treatment of cancer and its consequences.",Medical Facilities & Services,United States,16,,"Brandon Capital, UniSeed",,,Alive / Active,,
Nationwide Children's Hospital,nationwidechildrens.org,"Nationwide Children's Hospital is a pediatric acute care teaching hospital. It specializes in ear, nose, throat (otolaryngology) treatment, gastroenterology, hepatology and nutrition, hematology, oncology, blood and marrow transplant, neurology, pediatric surgery, and sports medicines. It was founded in 1892 and is based in Columbus, Ohio.",Medical Facilities & Services,United States,1.9,"Timothy Robinson (CEO), Steve Allen (CEO), Sean Gleeson (President), John Barnard (President), Denise Zabawski (CIO), Donna Teach (Chief Marketing Officer), Kathleen Dunn (Chief Compliance Officer), Rustin B  Morse MD MMM (Chief Medical Officer), Steve Testa (SVP), Peter White (Senior Director)",National Heart Lung and Blood Institute,,,Alive / Active,1892,
Christie Clinic,christieclinic.com,"Christie Clinic offers community healthcare services. It provides primary care, obstetrics and gynecology, ophthalmology, nephrology, rheumatology, radiation oncology, pulmonary medicine, a sleep center, transformations medical weight loss program, and more. The company was founded in 1929 and is based in Champaign, Illinois.",Medical Facilities & Services,United States,,,,,,Alive / Active,1929,
West County Radiological Group,westcountyradiology.com,"West County Radiological Group is a hospital-based radiology group. It consists of medical physicists and dosimetrists, a practice manager, and a full in-house billing office, which also does some outside billing for radiation oncology. It was founded in 1969 and is based in Saint Louis, Missouri.",Medical Facilities & Services,United States,,,,,,Alive / Active,1969,
UNIO Health Partners,uniohp.com,"UNIO Health Partners is a multi-specialty physician practice management company. It focuses on urology, gastroenterology, and radiation oncology. It provides a wide array of management services and supports numerous ancillary service lines. The company was founded in 2021 and is based in Los Angeles, California.",Medical Facilities & Services,United States,,"Marshal Salomon (CEO), Edward Cohen (President), Bradley Rogers (CFO), Paulina Tam (COO), Joe Chang (Chief Administrative Officer)","Beach Point Capital Management, Florac, Triton Pacific Capital Partners",,,Alive / Active,2021,
Medical Specialists Of The Palm Beaches,mspbhealth.com,"Medical Specialists Of The Palm Beaches offers healthcare and primary care services. Its services include cardiology, neurology, hematology-oncology, concierge healthcare, and wellness programs. Medical Specialists Of The Palm Beaches was founded in 1995 and is based in Boynton Beach, Florida.",Medical Facilities & Services,United States,,"Keith Parsons (CFO), Carlos Lira (Chief Medical Officer)",Ascend Partners,,,Alive / Active,1995,
Pullman Regional Hospital,pullmanregional.org,"Pullman Regional Hospital provides healthcare services. The hospital offers emergency services, audiology/ENT, cardiology, cardiopulmonary, pediatric care coordination, imaging, inpatient services, mental health, neurology, oncology and hematology, surgical services, orthopedics, therapy, and urology. It is based in Pullman, Washington.",Medical Facilities & Services,United States,,"Steve Febus (CFO), Megan Guido (Chief Marketing Officer)",,,,Alive / Active,,
MI Bioresearch,,"MI Bioresearch (MI) is a preclinical oncology solutions business. It offers in vitro and in vivo pharmacology services, in vivo imaging technologies, and focal radiation capabilities to support your research programs. On April 30, 2019, MI Bioresearch was acquired by Covance. The terms of the transaction were not disclosed.",Medical Facilities & Services,United States,14.94,"Thomas Ludlam (CEO), Patrick McConville (COO)","Arcus Ventures, Baird Venture Partners, Beringea, ID Ventures, LabCorp Drug Development",,,Acquired,2003,LabCorp Drug Development
Capital Health System,capitalhealth.org,"Capital Health provides health care services. The company offers neurosciences (brain and spine), oncology (cancer), digestive health, weight loss surgery, and breast care. orthopedics, heart, and vascular care, maternity, and surgery. Capital Health System was founded in 1998 and is based in Trenton, New Jersey.",Medical Facilities & Services,United States,0.5,,"Bank of America, EMSWorld Clinical Challenge, Violence Intervention Program",,,Alive / Active,1998,
Main Street Clinical Laboratory,mainstreetlab.com,"Main Street Clinical Laboratory, established in 2009, is dedicated to providing quality laboratory service to client and their patients. The company's test menu includes Chemistry, Hematology, Coagulation, Urinalysis, Therapeutic Drug Levels, Microbiology Anatomic Pathology, Immunology, Genetics, Hemostatis/Thrombosis, Immunohematology, and Oncology testing services.",Medical Facilities & Services,United States,,,Schryver Medical,,,Acquired,,Schryver Medical
Memorial Hospital at Gulfport,gulfportmemorial.com,"Memorial Hospital at Gulfport is a not-for-profit medical complex. Memorial offers comprehensive clinical programs, such as emergency medicine, women and children services, orthopedic services, cardiovascular services, neurosciences and oncology. Additionally, Memorial provides medical specialties which include a Level II Neonatal ICU and a primary stroke center.",Medical Facilities & Services,United States,,"Chris Belmont (CIO), Mark Gilbert MD FACEP (Chief Medical Officer), April LaFontaine FACHE MBA CPC (Chief Administrative Officer)",,,,Alive / Active,1946,
Radiation Oncology Associates,virginiaradiation.com,"Radiation Oncology Associates is a group of certified physicians that provides radiation therapy for a comprehensive range of malignancies, such as central nervous system, head and neck, thoracic, breast, upper and lower gastrointestinal, genitourinary, gynecologic, musculoskeletal, skin, lymphoid and myeloid, blood, as well as pediatric cancers. It is based in Ashland, Virginia.",Medical Facilities & Services,United States,,,,,,Alive / Active,,
Cancer and Aging Research Group,mycarg.org,"Cancer and Aging Research Group (CARG) gathers researchers and clinicians to offer research on geriatric oncology. It researches to improve the care of all older adults with cancer and their caregivers. It also develops chemo toxicity calculators and geriatric assessment tools. It was founded in 2006 and is based in Duarte, California.",Medical Facilities & Services,United States,,,,,,Alive / Active,2006,
Invitae,invitae.com,"Invitae (NYSE: NVTA) is a genetic information company. It brings genetic information into mainstream medical practice and provides a diagnostic service comprising hundreds of genes for a variety of genetic disorders associated with oncology, cardiology, neurology, pediatrics, and other rare disease areas. It was founded in 2010 and is based in San Francisco, California.",Medical Facilities & Services,United States,195.49,"Randal Scott (CEO), Sean George (President), Richard Tompane (President), Lee Bendekgey (CFO), Jill Hagenkord (Chief Medical Officer), Steve Lincoln (SVP)","Thomas McNerney & Partners, Genomic Health, Casdin Capital, Genesys Capital, Randy Scott, Redmile Group, Decheng Capital, Deerfield Management, OrbiMed Advisors, Rock Springs Capital, Three Leaf Ventures, Wellington Management, SoftBank, Plug and Play Abu Dhabi","Digital Health, Oncology Tech",D2C genetic tests (Healthcare & Life Sciences),IPO / Went public,2010,Public
Longmont United Hospital,,"Longmont United Hospital is a Planetree Patient-Centered Care Designated hospital. Its specialty areas include Women’s Services, Orthopedics, Cardiology, Oncology, Robotic Surgery, Transitional Care and Acute Medical Services. Its 24-hour Emergency Department is a Level III Trauma Center. It is based in Longmont, Colorado.",Medical Facilities & Services,United States,,,,,,Alive / Active,,
Eastside Medical Center,eastsidemedical.com,"Eastside Medical Center is a multi-campus system of care offering comprehensive medical and surgical programs including cardiovascular, neurosciences, oncology, orthopedics, robotic surgery, rehabilitation, maternity with neonatal intensive care, behavioral health, bariatric, urgent care, and 24-hour emergency care to Gwinnett County and the Greater Atlanta Area.",Medical Facilities & Services,United States,,"Trent Lind (CEO), Amy Wheeler (CFO), John Hoover (COO)",,,,Alive / Active,,
Memorial Hospital,mhtlc.org,"Memorial Hospital operates as a hospital providing healthcare facilities, designated for critical conditions and lifesaving services. It offers emergency rooms, obstetrics, surgery, inpatient, laboratories, gynecology, dermatology, senior counseling, diabetes health and wellness center, pulmonary rehabilitation, oncology, ophthalmology, and more. It was founded in 1950 and is based in Carthage, Illinois.",Medical Facilities & Services,United States,,,,,,Alive / Active,1950,
Artemis DNA,artemisgenomics.com,"Artemis DNA is a laboratory company that offers clinical diagnostic services. The company provides proprietary Next Generation Sequencing (NGS), genetic testing, and diagnostic laboratory services for a variety of medical specialties, including cardiology, oncology, immunology, neurology, reproductive health, and pharmacogenomics. The company was founded in 2019 and is headquartered in Irvine, California.",Medical Facilities & Services,United States,,"Emylee Thai (Founder), Ann Sabahat (CFO)",,,,Alive / Active,2019,
Crown Bioscience,crownbio.com,"Crown Bioscience (GTSM: 6554) operates as a drug discovery and development company. It provides translational platforms and drug discovery solutions for its biotechnology and pharmaceutical partners in the therapeutic areas of oncology and metabolic disease. The company was founded in 2006 and is based in San Diego, California. In May 2018, Crown Bioscience was acquired by JSR Corporation.",Drug Discovery,United States,74.35,"Yue Wu (CEO), Jean-Pierre Wery (President), Yi-Hua He (CFO), Bing Zhu (COO), Jiping Zha (SVP), Yixin Wang (SVP), Nalini M. (SVP), Yining Qi (Managing General Partner)","Chemizon, Qiming Venture Partners, Acorn Campus Ventures, Acorn Ventures, China Renaissance, GRC SinoGreen, Harbinger Venture Capital, ITIC Ventures, Kaiwu Capital, Argonaut Private Equity, CDIB Capital International, CID Group, China Renaissance Capital Investment, IBT, OrbiMed Advisors, Lilly Asia Ventures, JSR Corporation",,,Acquired,2006,"Public, JSR Corporation"
Imaging Endpoints,imagingendpoints.com,"Imaging Endpoints is an imaging research and core laboratory that provides imaging clinical research organization (CRO) services to evaluate drug and device efficacy. The company offers services related to oncology, neurology, musculoskeletal and also provides molecular imaging, theragnostic development, imaging biomarkers, and more services. It was founded in 2009 and is based in Scottsdale, Arizona.",Medical Facilities & Services,United States,,,,,,Alive / Active,2009,
Novella Clinical,novellaclinical.com,"Novella Clinical (Novella), a full-service clinical research organization (CRO) focused primarily on emerging oncology customers as well as those in the medical device and diagnostics sectors. Novella's infrastructure and approach to clinical research were created with the operational needs of its unique customer base in mind, and constructed to best support these specific customer groups.",Medical Facilities & Services,United States,,,Quintiles Transnational,,,Acquired,,Quintiles Transnational
Alegent Health,alegent.com,"Alegent Health was acquired by Catholic Health Initiatives (CHI Health). It is a network of hospitals and clinics. It provides healthcare services, including primary care, cardiology, orthopedics, oncology, cancer care, rehabilitation, behavioral services, maternity, pediatrics, inpatient and outpatient surgery, home care, and more. It was founded in 1996 and is based in Omaha, Nebraska.",Medical Facilities & Services,United States,,,Catholic Health Initiatives,,,Acquired,,Catholic Health Initiatives
Medical City Arlington,medicalcityarlington.com,"Medical City Arlington, formerly Medical Center Arlington, is an acute care hospital that has been serving Arlington, Grand Prairie, Kennedale, and Mansfield for more than 40 years. MCA offers more than 60 areas of specialized care that include Women's Services, Heart and Vascular Services, Emergency Services, Neurosciences, Orthopedics, Robotics, and Oncology.",Medical Facilities & Services,United States,,,,,,Alive / Active,,
Exeter Hospital,exeterhospital.com,"Exeter Hospital is a community-based hospital that provides health care services including breast health, birthing and reproductive medicine, cardiovascular, occupational and employee health, oncology and orthopedics. It was founded in 1896 and is based in Exeter, New Hampshire. On July 6th, 2022, Exeter Hospital was acquired by Beth Israel Lahey Health. Terms of the transaction were not disclosed.",Medical Facilities & Services,United States,,,Beth Israel Lahey Health,,,Acquired,1896,Beth Israel Lahey Health
PACLAB Network Laboratories,paclab.com,"PACLAB Network Laboratories operates as an integrated network of clinical laboratories. It offers hospital services like correlation sample requests, esoteric essentials, billing services like billing guides, medicare, pre-authorization form, contracted insurance, and clinical specialties like autoimmune disorders, cardiology, genetics, oncology, and more. The company was founded in 2001 and is based in Olympia, Washington.",Medical Facilities & Services,United States,,,,,,Alive / Active,2001,
iCura Diagnostics,icuradx.com,"iCura Diagnostics is a diagnostic laboratory that provides diagnostic tests to help with drug development and clinical patient management. It specializes in anatomic pathology, clinical pathology, hematology, as well as clinical informatics, histopathology, oncology, and more. The company offers diagnostics tools such as next-generation sequencing (NGS) and consultation for laboratory tests. iCura Diagnostics was founded in 2021 and is based in Malvern, Pennsylvania.",Medical Facilities & Services,United States,,Buer Song (CEO),,,,Alive / Active,,
Richland Memorial Hospital,richlandmemorial.com,"Richland Memorial Hospital (RMH) is a provider of healthcare services. It offers audiology, cardiology, intensive care, gynecology, oncology, psychiatry, and rehabilitation. It also provides services such as EKG, home health, medical and surgical unit, and ambulance. Richland Memorial Hospital (RMH) has now merged with Carle Health Center for Philanthropy (CCP). It is based in Olney, Illinois.",Medical Facilities & Services,United States,,,,,,Alive / Active,,
