Companies,URL,Description,Industry,Country,Total Funding (M),All People,All Investors,Expert Collections,Market Reports,Company Status,Founded Year,Acquirer
Attivare Therapeutics,attivaretx.com,"Attivare Therapeutics is a preclinical, venture-backed immunotherapy company. It develops novel vaccines to address major unmet needs in oncology and infectious diseases. It provides a modular, off-the-shelf, in vivo solution to control the activation of immune cells, in contrast to current ex vivo methods that require complex and costly manufacturing. It was founded in 2020 and is based in Natick, Massachusetts.",Medical Facilities & Services,United States,,,Axial,,,Alive / Active,2020,
Pomona Valley Hospital Medical Center,pvhmc.org,"Pomona Valley Hospital Medical Center is a not-for-profit facility. The hospital's services include centers in oncology, cardiac and vascular care, women's and children's services, and kidney stones. Specialized services include centers for breast health, sleep disorders, a neonatal ICU, a perinatal center, physical therapy/sports medicine, a full-service emergency department, robotic surgery, and the family medicine residency program.",Medical Facilities & Services,United States,,,,,,Alive / Active,1903,
Starling Physicians,starlingphysicians.com,"Starling Physicians provides hospitals and health care services. It offers internal medicine, cardiology, allergy, dermatology, ent, endocrinology, geriatrics, hematology/oncology, infectious disease, pain management, nephrology, gastroenterology, urology, and more services. The company was founded in 2016 and is based in Rocky Hill, Connecticut. In March 2023, Starling Physicians was acquired by VillageMD. The terms of the transaction were not disclosed.",Medical Facilities & Services,United States,,,VillageMD,,,Acquired,2016,VillageMD
Crystal Run Healthcare,crystalrunhealthcare.com,"Crystal Run Healthcare provides healthcare services. It offers urgent care, diagnostic, audiology, occupational and physical therapy, orthopedic robotic surgery, and sleep center services. The company specializes in oncology, cardiology, and surgery center. It was founded in 1996 and is based in Middletown, New York. In February 2023, Crystal Run Healthcare was acquired by UnitedHealth Group. The terms of the transaction were not disclosed.",Medical Facilities & Services,United States,,"Hal Teitelbaum MD JD MBA (CEO), Steve Zeng (CFO), Dan Taillard (CFO), Francis Cheung (CIO)",UnitedHealth Group,,,Acquired,1996,UnitedHealth Group
Campbell Clinic,campbellclinic.com,"Campbell Clinic operates a clinic and ambulatory surgery centers. The clinic specializes in sports medicine, pediatric orthopedics, joint replacement, orthopedic oncology, orthopedic trauma, physical medicine, rehabilitation, and surgery of the hand, hip, foot, knee, shoulder, and spine. The clinic cares for patients and treats congenital issues, including bone, and joint problems affecting senior adults. It is based in Germantown, Tennessee.",Medical Facilities & Services,United States,,Daniel Shumate (CFO),MB Venture Partners,,,Alive / Active,,
CuraScript,curascript.com,"CuraScript SD operates six specialty pharmacies throughout the United States. CuraScript has a broad product offering, with strong capabilities in oncology, rheumatoid arthritis, multiple sclerosis, and other complex chronic therapies. It has a solid reputation for quality patient care and expertise in serving client's needs in the specialty market, which will enhance Express Scripts' competitive positioning. CuraScript was founded in 1989 and is based in Lake Mary, Florida.",Medical Facilities & Services,United States,,"Dom Meffe (CEO), Claudia Griffiths (CFO), Don Howard (COO)","GTCR, Express Scripts",,,Acquired,1989,"GTCR, Express Scripts"
Grande Ronde Hospital,grh.org,"Grande Ronde Hospital (GRH) provides healthcare services. It offers services including diagnostic imaging services, emergency services, respiratory care services, occupational and speech rehabilitation therapy services, home care services, and more. The hospital also provides a cardiology clinic, dermatology clinic, hematology and oncology clinic, sleep clinic, and specialty clinic among others. It was founded in 1907 and is based in La Grande, Oregon.",Medical Facilities & Services,United States,,,,,,Alive / Active,1907,
Conisus,conisus.com,"Conisus is a network of companies dedicated to improving the care of patients with cancer and blood disorders by delivering superior medical education programs to healthcare professionals. The company's goal is to provide world-class oncology content while demonstrating unrivaled service to healthcare professionals, clients, and educational supporters, ensuring the highest degree of integrity. In January 2011, Conisus was acquired by Webster Capital. The valuation of Conisus was undisclosed. Other terms of the deal were not released.",Medical Facilities & Services,United States,46.5,"Richard Leff (Chief Medical Officer), Rebecca Howard PhD (SVP)","Monroe Capital, Webster Equity Partners",,,Alive / Active,,Webster Equity Partners
Metro Health,metrohealth.net,"Metro Health is a healthcare system featuring a general acute-care osteopathic teaching hospital, neighborhood physician offices located throughout West Michigan, nationally-recognized heart & vascular services, a wide range of award-winning inpatient and outpatient specialty services, a cancer center developed in partnership with the University of Michigan department of radiation oncology, a wellness and community education program, plus joint ventures with other healthcare providers, a medical education program and more.",Medical Facilities & Services,United States,,,"Michigan Medicine, Community Health Systems",,,Acquired,1942,"Community Health Systems, Michigan Medicine"
Southwell,mysouthwell.com,"Southwell is a growing, not-for-profit health system serving 12 counties in South Central Georgia. Southwell offers more than 135 physicians with expertise in over 30 specialties. Southwell provides a wide-range of care, including signature services in surgery, oncology, cardiovascular care, women’s health, neurodiagnostics, geriatric psychiatric care, radiology and more. The Main Campus is Tift Regional Medical Center, a 181-bed regional referral hospital located in Tifton.",Medical Facilities & Services,United States,,"Christopher Dorman (CEO), Kim Wills (CFO), Alex Le (COO), Marie Roof (CIO), David McEachin (Chief Medical Officer), Claire Byrnes (SVP), Carol Smith (SVP), Karen Summerlin (SVP)",,,,Alive / Active,,
Phelps Memorial Health Center,phelpsmemorial.com,"Phelps Memorial Health Center is a nonprofit hospital. Its services include cardiopulmonary services, cardiac rehab, diabetes education, diagnostic imaging (radiology), emergency services (ER), general surgery, immunizations, lab services, obstetrics, oncology, orthopedics, outpatient surgeries, pain management procedures, podiatry, special care, surgical services, physical therapy, speech therapy, occupational therapy, and urology. Phelps Memorial Health Center was founded in 1968 and is based in Holdrege, Nebraska.",Medical Facilities & Services,United States,,,,,,Alive / Active,1968,
VantagePoint Laboratory Partners,vpointlabs.com,"VantagePoint is a clinical laboratory providing a wide range of services primarily focused on the highly specialized, esoteric testing segment of the clinical laboratory market. The company performs both routine and sophisticated diagnostic tests for a broad range of conditions in oncology, infectious disease and hereditary disorders, allowing physicians to improve clinical outcomes and avert more costly and less effective treatments through personalized, patient-tailored therapies. The company's central laboratory in San Diego services all geographies in the U.S.",Medical Facilities & Services,United States,101.04,,Enhanced Healthcare Partners,,,Alive / Active,,
Mon Health System,monhealth.com,"Mon Health is a three-hospital system including Mon Health Medical Center, Mon Health Preston Memorial Hospital, and Mon Health Stonewall Jackson Memorial Hospital. It provides oncology, orthopedics, sports medicine, physical therapy, obstetrics, gynecology, general surgery, and other healthcare services. The company was founded in 1943 and is based in Morgantown, West Virginia. In March 2022, Mon Health System merged with CAMC Health System to form Vandalia Health.",Medical Facilities & Services,United States,,,Vandalia Health,,,Merged,1943,Vandalia Health
Accell Clinical Research,accellclinical.com,"Accell Clinical Research is an international contract research organization (CRO) that offers services in clinical trial management, functional outsourcing, and strategic guidance. It specializes in site selection, project management, monitoring, QA and QC, regulatory support, safety management, clinical trial material management, medical writing, flexible customer engagement models, Phase I-IV clinical trials, oncology clinical trials, outsourcing of clinical staff, and more. It was founded in 2006 and is based in Warrenton, Virginia.",Medical Facilities & Services,United States,,,,,,Alive / Active,2006,
PRA Health Sciences,prahs.com,"PRA Health Sciences (NASDAQ: PRAH) is a global, contract research organization with the expertise and capability to conduct clinical trials across all major therapeutic areas on a global basis. The company has therapeutic expertise in areas that are among the largest in pharmaceutical development, including oncology, central nervous system, inflammation, and infectious diseases. PRA provides clients with flexible, clinical development service offerings, which include traditional, project-based Phase I through Phase IV services and embedded and functional outsourcing services.",Medical Facilities & Services,United States,,"Patrick Donnelly (President), Margaret Keegan (EVP)","Genstar Capital, Kansas Bioscience Authority, KKR, Carlyle, ICON","Digital Health, Telehealth, Conference Exhibitors, Oncology Tech",,Acquired,1976,"Carlyle, Public, KKR, Genstar Capital, ICON"
Chestnut Hill Hospital,chhealthsystem.com,"Chestnut Hill Hospital is a community healthcare provider. It provides services to inpatient and outpatient, diagnostic and treatment services including minimally invasive laparoscopic and robotic-assisted surgery, cardiology, gynecology, oncology, and orthopedics, primary care practices, women's centers and an off-site physical therapy center. The company was founded in 1995 and is based in Philadelphia, Pennsylvania. In August 2022, Chestnut Hill Hospital was acquired by Temple Health, Redeemer Health, and Philadelphia College of Osteopathic Medicine. The terms of the transaction were not disclosed.",Medical Facilities & Services,United States,,,"Community Health Systems, Tower Health, Philadelphia College of Osteopathic Medicine, Redeemer Health, Temple Health",,,Acquired,1995,"Community Health Systems, Philadelphia College of Osteopathic Medicine, Tower Health, Temple Health , Redeemer Health"
Wheat Ridge Animal Hospital,wheatridgeanimal.com,"Wheat Ridge Animal Hospital started as a general practice in 1955 and has grown to a large specialty referral practice and a 24-hour emergency and critical care practice. The team is comprised of 4 general practitioners and 15 board-certified specialists in surgery, internal medicine, neurology, cardiology, dermatology, radiology, oncology and emergency and critical care. The support staff is a fundamental part of the team consisting of certified veterinary technicians, veterinary assistants, client care representatives and management with extensive experience in veterinary health services.",Medical Facilities & Services,United States,,,Premier Veterinary Group,,,Merged,,Premier Veterinary Group
Sequenom Center for Molecular Medicine,,"Sequenom Center for Molecular Medicine (SCMM) is an molecular pathology laboratory created specifically to support cutting-edge diagnostics, translational research and clinical trials. SCMM is primarily focused on the areas of technology development, women's health and oncology. Based in Grand Rapids, Michigan, SCMM collaborates with Spectrum Health, one of Michigan's largest not-for-profit health systems which annually aims to serve hundreds of thousands of patients, and the Van Andel Research Institute, which aims to offer translational research and bioinformatics expertise with the latest in genomics and proteomics technology.",Medical Facilities & Services,United States,,,West Michigan Science & Technology Initiative New Venture Center,,,Alive / Active,,
Bedford Laboratories,bedfordlabs.com,"Bedford Laboratories is a provider of generic sterile injectable medicines with a focus on acute-care hospitals, group purchasing organizations and oncology treatment centers. Bedford Laboratories develops and distributes a broad portfolio of high-quality, medically necessary medicines to patients in hospitals and clinics across the United States and Puerto Rico through authorized distributors and drug wholesalers. Founded in 1993, Bedford has one of the largest and most experienced generic injectable salesforces in the industry, and is one of the top three Abbreviated New Drug Application (ANDA) holders in the U.S. Bedford's capabilities include Sales and Marketing, Business Development, New Product Development and Regulatory Affairs.",Medical Facilities & Services,United States,,,Hikma Pharmaceuticals,,,Acquired,,Hikma Pharmaceuticals
ApoCell,apocell.com,"ApoCell is a privately-held specialty clinical research company. Founded in 2004, the firm is a provider in molecular biomarker detection and analysis, leveraging its experience in the areas of oncology, diabetes, molecular diagnostics and drug development to measure biomarker signatures in clinical trial subjects. The company's methods provide early proof of mechanism of action and monitor the effectiveness of various types of drugs by measuring biomarker expression patterns in biopsies, blood and rare cell types. The company's facilities are CLIA-certified and compliant with applicable FDA regulations. Since inception, the company has participated in over 140 Phase I, II, and III clinical cancer drug trials for more than 80 sponsor clients worldwide.",Medical Facilities & Services,United States,1,Darren Davis (CEO),"Summit Partners, National Cancer Institute, Precision for Medicine","Digital Health, Oncology Tech",,Acquired,2004,Precision for Medicine
St. Mary's Medical Center,stmaryskc.com,"St. Mary's Medical Center is a 146-bed acute-care hospital. The hospital has a 24-hour Emergency Department, Accredited Chest Pain Center, Cardiac Surgery [Carondelet Heart Institute], Certified Stroke Center, Breast Center, Radiation Oncology, Center for Wound Care and Hyperbaric Medicine, Pain Center and the only Inpatient Rehabilitation Center between Blue Springs and Columbia, MO. St. Mary's Medical Center earned recognition as a 2013 Top Performer on Key Quality Measures by The Joint Commission, the leading accreditor of health care organizations in the nation. In 2014, The Joint Commission's annual report ""America's Hospitals: Improving Quality and Safety,"" recognized St. Mary's for attaining and sustaining excellence in accountability measure performance for: heart attack, pneumonia, surgical care and stroke.",Medical Facilities & Services,United States,,Todd Campbell (President),Prime Healthcare,,,Acquired,1981,Prime Healthcare
HealthTronics Laboratory Solutions,labs.healthtronics.com,"HealthTronics Laboratory Solutions (HLS) provides anatomical pathology services primarily to the urology community. The HLS pathology labs are located in Georgia and Pennsylvania and provide laboratory and diagnostic services to urologists throughout the U.S., with client practices in 41 states. In addition, HLS manages pathology laboratories for physician practice groups, provides administrative services to in-office pathology labs for practice groups, and provides pathology services to physicians. HealthTronics has been a national provider of urological and interventional oncology services and products for more than 20 years. Headquartered in Austin, Texas, with anatomical pathology laboratories in three states, the company provides the most advanced technology and premiere support systems to urologists, interventional radiologists, hospitals, surgery centers and clinics across the United States. HealthTronics is an operating company of Endo Health Solutions.",Medical Facilities & Services,United States,,,Metamark Genetics,,,Acquired,,Metamark Genetics
Cadence Health,cadencehealth.org,"Cadence Health was formed in March 2011 as a result of the merger between Central DuPage Health System based in Winfield, Ill., and Delnor Community Health System based in Geneva, Ill. Cadence Health is a locally based, locally governed health system focused on delivering excellent health care to the more than 1.1 million patients in Chicago's western suburbs. For seven of the past eight years (2006-2010, 2012, 2013), Central DuPage Hospital (CDH) has been selected by Truven Health Analytics as one of the ""100 Top Hospitals in the U.S."" Delnor Hospital recently received accreditation by the American College of Surgeon's National Accreditation Program of Breast Centers for the Delnor Center for Breast Health. CDH and Delnor currently maintain affiliations with Ann & Robert H. Lurie Children's Hospital of Chicago for pediatric specialty care and Cleveland Clinic for cardiac surgery, adult medical oncology, and cardiology services. Both hospitals have achieved Magnet recognition for excellence in nursing services from the American Nurses Credentialing Center.",Medical Facilities & Services,United States,,,Northwestern Memorial HealthCare,,,Merged,,Northwestern Memorial HealthCare
CoreLab Partners,corelabpartners.com,"CoreLab Partners, formerly Medifacts International, offers the worldwide biopharmaceutical industry service quality, dedicated global capabilities and advanced technologies, with 100% on-time delivery of all projects. CoreLab Partners also provides clinical trial sponsors with best-in-class centralized cardiac safety and efficacy services, and independent medical image assessment solutions-all designed to facilitate successful new drug development in the pharmaceutical, biotechnology and medical device market sectors. CoreLab Partners' services include medical image management, interpretation, and response assessment for clinical trials, with a particular focus on the oncology therapeutic area. CoreLab Partners also provides regulatory support and digital image submission, as well as cost-effective cardiac safety assessments for development programs, support for clinical studies, and equipment rental. The company also offers worldwide ambulatory blood pressure monitoring services, digital ECG services, and cardiac safety services. CoreLab Partners was created through the merger of Medifacts and Radpharm in February 2010. The investment funding history of Medifacts and Radpharm can be seen on their respective company profiles. The investors from Medifacts and Radpharm are detailed on Corelabs profile as these investors maintained ownership in Corelabs post merger. In January 2013, CoreLab Partners was acquired by JLL Partners. The valuation of CoreLab Partners was undisclosed. Other terms of the deal were not released. In March 2013, JLL Partners merged CoreLab Partners with BioClinica.",Medical Facilities & Services,United States,,"Michael Woehler (CEO), Denis Manginelli (CFO), Jerry Decker (CFO), Boaz Mendzelevski (Chief Medical Officer)","Adams Street Partners, Ampersand Capital Partners, SV Health Investors, Tang Capital Management, next47, JLL Partners, BioClinica",,,Merged,1985,"JLL Partners, BioClinica"